{
 "schema_version": 1,
 "step_continue": [
  {
   "schema_version": 1,
   "gate_id": "gate-S-001",
   "run_id": "20260930-120000-run-1",
   "plan_digest": "aaaaaaaaaaaaaaaaaaaaaaaaaaaaaaaaaaaaaaaaaaaaaaaaaaaaaaaaaaaaaaaa",
   "contract_digest": "aaaaaaaaaaaaaaaaaaaaaaaaaaaaaaaaaaaaaaaaaaaaaaaaaaaaaaaaaaaaaaaa",
   "step_id": "S-001",
   "candidate_sha": "0123456789abcdef0123456789abcdef01234567"
  }
 ],
 "attestations": [
  {
   "criterion_id": "R-001.C2",
   "plan_digest": "aaaaaaaaaaaaaaaaaaaaaaaaaaaaaaaaaaaaaaaaaaaaaaaaaaaaaaaaaaaaaaaa",
   "contract_digest": "aaaaaaaaaaaaaaaaaaaaaaaaaaaaaaaaaaaaaaaaaaaaaaaaaaaaaaaaaaaaaaaa",
   "candidate_sha": "0123456789abcdef0123456789abcdef01234567",
   "result": "passed",
   "observation": "The release notes show the flag.",
   "environment": "staging",
   "observed_at": "2026-10-01T10:00:00Z",
   "actor": "local user",
   "evidence_refs": []
  }
 ],
 "answers": [
  {
   "question_id": "msg-000007",
   "text": "stdout"
  }
 ]
}